{
  "schema_version": 1,
  "chapter_snapshot_id": "chapter-snapshot:01JZWRITING00000000000001",
  "writing_run_id": "01JZWRITING00000000000001",
  "project_id": "01JZPROJECT000000000000001",
  "chapter_plan_id": "01JZCHPLAN000000000000001",
  "accepted_chapter_ref": "object://manuscripts/01JZWRITING00000000000001/chapters/1",
  "chapter_title": "乌坦城风起",
  "chapter_text": "萧炎在众目睽睽下接住羞辱，也接住了自己的三年之约。",
  "source_section_refs": [
    "object://section-runs/01JZSECRUN00000000000001",
    "object://section-runs/01JZSECRUN00000000000002",
    "object://section-runs/01JZSECRUN00000000000003"
  ],
  "created_at": "2026-07-11T03:12:00Z"
}
